text,clean_text,processed_text,emojis,label,app,language
Napa mysejater skrg xfuntion buka keluar putih je ingtkn sbb fon wat dkt fon lain pn sma... Org lain nk daftar letak keputusan swep test pn sma kluar putih,napa mysejater skrg xfuntion buka keluar putih je ingtkn sbb fon wat dkt fon lain pn sma org lain nk daftar letak keputusan swep test pn sma kluar putih,napa mysejater skrg xfuntion buka putih ingtkn sbb fon wat dkt fon pn sma org nk daftar letak putus swep test pn sma kluar putih,,negative,MySejahtera,ms
"Touch 'n Go eWallet has made cashless payments so convenient in Malaysia! From paying tolls and parking to splitting bills and online shopping, it handles everything with ease. The GoPayLater and GoInvest features are excellent additions that make it more than just a payment app. Top-ups are instant and the cashback deals are genuinely great value!""",touch n go ewallet has made cashless payments so convenient in malaysia from paying tolls and parking to splitting bills and online shopping it handles everything with ease the gopaylater and goinvest features are excellent additions that make it more than just a payment app topups are instant and the cashback deals are genuinely great value,touch go ewallet made cashless payment conveni malaysia pay toll park split bill onlin shop handl everyth eas gopaylat goinvest featur excel addit make payment app topup instant cashback deal genuin great valu,,positive,Touch n Go eWallet,en
macam bodoh takleh login,macam bodoh takleh login,bodoh takleh login,,negative,MySejahtera,en
nipah virus coming.gotta download this app to prevent nipah virus,nipah virus cominggotta download this app to prevent nipah virus,nipah virus cominggotta download app prevent nipah virus,,positive,MySejahtera,en
"boleh tak jangan rompak duit orang, letak kat tempat aku tak boleh nak gune, boleh tak jangan letak duit aku kat go plus sampai aku tak boleh makan sebab insufficient fund, bukan semua orang kaye",boleh tak jangan rompak duit orang letak kat tempat aku tak boleh nak gune boleh tak jangan letak duit aku kat go plus sampai aku tak boleh makan sebab insufficient fund bukan semua orang kaye,tak jangan rompak duit letak kat tak nak gune tak jangan letak duit kat go plus tak makan insuffici fund bukan kay,,negative,Touch n Go eWallet,en
I can't open this app right now and I don't know why.. All my apps are updated automatically if needed to be updated.. But now..I really don't understand why I can't open this app 🤔,i cant open this app right now and i dont know why all my apps are updated automatically if needed to be updated but nowi really dont understand why i cant open this app,cant open app right dont know app updat automat need updat nowi realli dont understand cant open app,🤔,neutral,MySejahtera,en
i hate this because i wait so long to wait the driver accept my booking!!!!,i hate this because i wait so long to wait the driver accept my booking,hate wait long wait driver accept booking,,negative,Grab,ms
"𝑺𝒕𝒐𝒑 𝒖𝒑𝒅𝒂𝒕𝒆 𝒍𝒂𝒉, 𝒃𝒖𝒌𝒂𝒏 𝒅𝒊𝒈𝒖𝒏𝒂𝒌𝒂𝒏 𝒍𝒂𝒈𝒊 𝒔𝒆𝒌𝒂𝒓𝒂𝒏𝒈 😅",𝑺𝒕𝒐𝒑 𝒖𝒑𝒅𝒂𝒕𝒆 𝒍𝒂𝒉 𝒃𝒖𝒌𝒂𝒏 𝒅𝒊𝒈𝒖𝒏𝒂𝒌𝒂𝒏 𝒍𝒂𝒈𝒊 𝒔𝒆𝒌𝒂𝒓𝒂𝒏𝒈,,😅,neutral,MySejahtera,ms
skrang grab susah kan org.limpas dari jam 12 TGH malam dah tak boleh bayar cash.so kami yg tak ada bank online susah nak keluar sampai TGH malam.harap boleh d pertimbangkan lagi.,skrang grab susah kan orglimpas dari jam tgh malam dah tak boleh bayar cashso kami yg tak ada bank online susah nak keluar sampai tgh malamharap boleh d pertimbangkan lagi,skrang grab susah orglimpas jam tgh malam dah tak bayar cashso yg tak bank online susah nak tgh malamharap timbang,,negative,Grab,ms
Loading teruk nak buat appointment pun tak boleh,loading teruk nak buat appointment pun tak boleh,loading teruk nak appointment tak,,negative,MySejahtera,ms
Dah bnyk kali nak tekan kata laluan mesej tak sampai²,dah bnyk kali nak tekan kata laluan mesej tak sampai²,dah bnyk nak tekan lalu mesej tak,,negative,MySejahtera,ms
MCM mane nk masuk semula.. hari tu fon... Terus xboleh masuk semula,mcm mane nk masuk semula hari tu fon terus xboleh masuk semula,mcm mane nk fon xboleh,,neutral,MySejahtera,ms
"Its not bad at all. Very convinient. Just some little irritants. 1. Ads. I'm trying to pay right now, and I get pop ups and ads. Very counter intuitive to the design of the application. 2. Can be quite slow. Generally not a problem but is confounded by the ads.",its not bad at all very convinient just some little irritants ads im trying to pay right now and i get pop ups and ads very counter intuitive to the design of the application can be quite slow generally not a problem but is confounded by the ads,not bad convini littl irrit ad im tri pay right get pop up ad counter intuit design applic quit slow general not problem confound ad,,neutral,Touch n Go eWallet,en
tutup app MySejahtera,tutup app mysejahtera,tutup app mysejahtera,,positive,MySejahtera,ms
Tk boleh buka.. Beli sim baru.. Tpi nombor masih customer yang lama pakai.. Baik tk payah jual sim maxis ni.. Susahkan orang nk buka halaman ni.. Baik pakai celcom agi bagus,tk boleh buka beli sim baru tpi nombor masih customer yang lama pakai baik tk payah jual sim maxis ni susahkan orang nk buka halaman ni baik pakai celcom agi bagus,tk buka beli sim tpi nombor customer pakai tk payah jual sim maxis susah nk buka halaman pakai celcom agi bagus,,neutral,Grab,ms
Payment is smooth sailing. Feel safe only if it is really secured.,payment is smooth sailing feel safe only if it is really secured,payment smooth sail feel safe realli secur,,positive,Touch n Go eWallet,en
online topup wallet so slow,online topup wallet so slow,online topup wallet slow,,negative,Grab,ms
tak memuaskan hati saya tidak dapat buat loan apa yang nak masih lagi tak dapat,tak memuaskan hati saya tidak dapat buat loan apa yang nak masih lagi tak dapat,tak muas hati tidak loan nak tak,,negative,Grab,ms
"“The app is simple to use and provides a smooth payment experience with good security features. It also supports QR payments, making transactions quicker and more efficient in daily life.”",“the app is simple to use and provides a smooth payment experience with good security features it also supports qr payments making transactions quicker and more efficient in daily life”,app simpl use provid smooth payment experi good secur featur also support qr payment make transact quicker effici daili life,,positive,Touch n Go eWallet,en
pay through online not activated because use grab pay ewallet,pay through online not activated because use grab pay ewallet,pay onlin not activ use grab pay ewallet,,neutral,Grab,en
After I got the app back I don't know where to upload and update my covid test..... Someone please help me n show me thanks,after i got the app back i dont know where to upload and update my covid test someone please help me n show me thanks,got app back dont know upload updat covid test someon pleas help show thank,,neutral,MySejahtera,en
saya guna Oppo a93. selepas update terkini. app crash. hang. jadi black screen.,saya guna oppo a selepas update terkini app crash hang jadi black screen,oppo selepa updat terkini app crash hang black screen,,neutral,MySejahtera,en
"Tutup je lah Apps nie,nak Login pun payah",tutup je lah apps nienak login pun payah,tutup apps nienak login payah,,negative,Grab,ms
"recent update put useful mini apps to dormant. change of UI and buttons not for ease of usage but to force as much ads as possible to users. the TnG card button is no where to be found, probably hidden somewhere, thou can still be viewed with search bar. worst UI development team ever, you need to get them replaced.",recent update put useful mini apps to dormant change of ui and buttons not for ease of usage but to force as much ads as possible to users the tng card button is no where to be found probably hidden somewhere thou can still be viewed with search bar worst ui development team ever you need to get them replaced,recent updat put use mini app dormant chang ui button not eas usag forc much ad possibl user tng card button no found probabl hidden somewher thou still view search bar worst ui develop team ever need get replac,,negative,Touch n Go eWallet,en
Selamat berinstall kembali semua,selamat berinstall kembali semua,selamat berinstal,,positive,MySejahtera,en
"it's quite good BUT make sure you select card before your first journey, otherwise there's no way to change once you start and you can get caught out, which is a stupid design",its quite good but make sure you select card before your first journey otherwise theres no way to change once you start and you can get caught out which is a stupid design,quit good make sure select card first journey otherwis there no way chang start get caught stupid design,,neutral,Grab,en
jangan teraniaya sudah,jangan teraniaya sudah,jangan aniaya,,neutral,Touch n Go eWallet,ms
daftar dengan ID KTP indonesia mengapa tidak bisa selalu berulang dengan sahkan akun,daftar dengan id ktp indonesia mengapa tidak bisa selalu berulang dengan sahkan akun,daftar id ktp indonesia tidak ulang sahkan akun,,negative,Touch n Go eWallet,ms
Gets a new apps. ..,gets a new apps,get new app,,positive,MySejahtera,en
aritu ada untuk tengok bilangan Blood Donor .. sekarang dah xde. kenapaaa ??,aritu ada untuk tengok bilangan blood donor sekarang dah xde kenapa,aritu tengok bilangan blood donor dah xde,,neutral,MySejahtera,en
memudahkan urusan kewangan dalam perbelanjaan,memudahkan urusan kewangan dalam perbelanjaan,mudah urus wang belanja,,positive,Touch n Go eWallet,ms
Appointment option x function. loading all the time,appointment option x function loading all the time,appoint option function load time,,negative,MySejahtera,en
"A+Rewards can't purchase the vouchers with pop up T& C error issue like Reload Pin vouchers and Taobao vouchers from last night until now still not solved yet. Recently, A+ Reward purchase vouchers payment system also usually failed pop up E Wall payment method error. Why the Technical Support of the system can't detect the problems immediately and solved it immediately? poor support",arewards cant purchase the vouchers with pop up t c error issue like reload pin vouchers and taobao vouchers from last night until now still not solved yet recently a reward purchase vouchers payment system also usually failed pop up e wall payment method error why the technical support of the system cant detect the problems immediately and solved it immediately poor support,areward cant purchas voucher pop error issu like reload pin voucher taobao voucher last night still not solv yet recent reward purchas voucher payment system also usual fail pop wall payment method error technic support system cant detect problem immedi solv immedi poor support,,negative,Touch n Go eWallet,en
Excellent and very helpful for the new traveller's who need guidance,excellent and very helpful for the new travellers who need guidance,excel help new travel need guidanc,,positive,Grab,en
ok ok ok rm50. (rm49.50!),ok ok ok rm rm,ok ok ok rm rm,,positive,Touch n Go eWallet,en
Aplikasi ini sangat berguna untuk membuat temu janji di hospital yang berdekatan.,aplikasi ini sangat berguna untuk membuat temu janji di hospital yang berdekatan,aplikasi berguna temu janji hospit berdekatan,,positive,MySejahtera,en
"baru update apps ni, tpi makin pening, skrg mmg dh x boleh top up card tngo guna nfc ke mcm mne, sbb dh xde button utk card tngo tu",baru update apps ni tpi makin pening skrg mmg dh x boleh top up card tngo guna nfc ke mcm mne sbb dh xde button utk card tngo tu,updat app tpi pene skrg mmg dh top card tngo nfc mcm mne sbb dh xde button utk card tngo,,negative,Touch n Go eWallet,en
"Kalau ada penunjuk SETIAP TRANSAKSI baki sebelum, jumlah pembayaran dan baki semasa",kalau ada penunjuk setiap transaksi baki sebelum jumlah pembayaran dan baki semasa,penunjuk transaksi baki pembayaran baki,,neutral,Touch n Go eWallet,en
"lotteria cancels on me and the app wont give me my voucher back, so yeah",lotteria cancels on me and the app wont give me my voucher back so yeah,lotteria cancel app wont give voucher back yeah,,neutral,Grab,en
Maklumat kewangan aku..apakah kamu tahu mygov..?tanya dahulu itu lebih baik.dari pada mengambil keputusan tanpa persetujuan hak hidup sebagai manusia..,maklumat kewangan akuapakah kamu tahu mygovtanya dahulu itu lebih baikdari pada mengambil keputusan tanpa persetujuan hak hidup sebagai manusia,maklumat wang akuapakah mygovtanya baikdari ambil putus tanpa tuju hak hidup manusia,,positive,MySejahtera,ms
Kemaskini sistem bahasa kebangsaan negaraku,kemaskini sistem bahasa kebangsaan negaraku,kemaskini sistem bahasa bangsa negara,,neutral,MySejahtera,ms
Ermmm susah sa mo kumen klu ini..😔,erm susah sa mo kumen klu ini,erm susah sa mo kumen klu,😔,neutral,MySejahtera,ms
"panggil saya book appointment,tapi hari2 tak ada slot",panggil saya book appointmenttapi hari tak ada slot,panggil book appointmenttapi tak slot,,negative,MySejahtera,en
"Getting better, good job well done!! Software Engineer",getting better good job well done software engineer,get better good job well done softwar engin,,neutral,Touch n Go eWallet,en
tolong di review lagi app nya. makin ke sini makin kurang oke. dapat driver lokasi jauh banget dari titik penjemputan jadi tunggu lama dan kasian drivernya juga ongkos bensin buat narik makin banyak.,tolong di review lagi app nya makin ke sini makin kurang oke dapat driver lokasi jauh banget dari titik penjemputan jadi tunggu lama dan kasian drivernya juga ongkos bensin buat narik makin banyak,tolong review app oke driver lokasi banget titik penjemputan tunggu kasian drivernya ongko bensin narik,,negative,Grab,en
vaksin sy sini keluar satu ja,vaksin sy sini keluar satu ja,vaksin sy ja,,negative,MySejahtera,ms
kenapa selepas update jadi lama bila buka.. terlalu lama loading.. dan sangat berat,kenapa selepas update jadi lama bila buka terlalu lama loading dan sangat berat,lepas update buka loading berat,,neutral,Touch n Go eWallet,ms
"The recent update makes it less convenient to view my eWallet balance. The app now prominently displays total assets across all TNG financial products, which may be useful for some users but is unnecessary for those who primarily use the app as an e-wallet. I preferred the previous interface, where the Wallet balance was shown by default and total assets were available under GoFinance. Please consider restoring this option to improve usability and privacy.",the recent update makes it less convenient to view my ewallet balance the app now prominently displays total assets across all tng financial products which may be useful for some users but is unnecessary for those who primarily use the app as an ewallet i preferred the previous interface where the wallet balance was shown by default and total assets were available under gofinance please consider restoring this option to improve usability and privacy,recent updat make less conveni view ewallet balanc app promin display total asset across tng financi product may use user unnecessari primarili use app ewallet prefer previous interfac wallet balanc shown default total asset avail gofin pleas consid restor option improv usabl privaci,,negative,Touch n Go eWallet,en
Selalu berubah ubah kereta. Sepatutnya 1 warna sudah memadai,selalu berubah ubah kereta sepatutnya warna sudah memadai,ubah ubah kereta patut warna pada,,neutral,Grab,ms
The old UI was more seamless with nested transport types under one. whoever made this change to separate tuktuk from car is just silly and is why I am reducing to 4 star. otherwise happy with the service.,the old ui was more seamless with nested transport types under one whoever made this change to separate tuktuk from car is just silly and is why i am reducing to star otherwise happy with the service,old ui seamless nest transport type one whoever made chang separ tuktuk car silli reduc star otherwis happi servic,,positive,Grab,en
"Recently after updated, the fixed notification for MySJ Trace always appeared even though I don't turn it on. Please fix this.. Thanks",recently after updated the fixed notification for mysj trace always appeared even though i dont turn it on please fix this thanks,recent updat fix notif mysj trace alway appear even though dont turn pleas fix thank,,negative,MySejahtera,en
sedih nya..dh kemaskini terus ada masalah ..sebelum kemas kini ok ja tng ni..,sedih nyadh kemaskini terus ada masalah sebelum kemas kini ok ja tng ni,sedih nyadh kemaskini kemas ok ja tng,,negative,Touch n Go eWallet,ms
Sangat sangat baik terima kasih..,sangat sangat baik terima kasih,terima kasih,,positive,Grab,ms
wai sedikan pin grab lah AP lah. tetap jugak salah apa erk. tangan aku salah typ ke apa sampai sebulan aku tk leh login ke acc aku,wai sedikan pin grab lah ap lah tetap jugak salah apa erk tangan aku salah typ ke apa sampai sebulan aku tk leh login ke acc aku,wai dik pin grab ap jugak salah erk tangan salah typ bulan tk leh login acc,,negative,Grab,ms
all utilities bills payment in 1 app,all utilities bills payment in app,util bill payment app,,positive,Touch n Go eWallet,en
why didn't have touch n go payment?,why didnt have touch n go payment,didnt touch go payment,,neutral,Grab,en
"setakat 4 tahun saya guna, tak ade lagi masalah yang saya hadapi. cara nak guna mudah tapi untuk sesetangah orang mungkin susah sikit tapi untuk saya, semuanya Oke je.",setakat tahun saya guna tak ade lagi masalah yang saya hadapi cara nak guna mudah tapi untuk sesetangah orang mungkin susah sikit tapi untuk saya semuanya oke je,setakat tahun tak ade hadapi nak mudah sesetangah susah sikit oke,,positive,MySejahtera,en
"Horrible cs whatsapp for go invest principal, ending chat without follow up email | Always have scammy programs like Buzz that loves rugpull",horrible cs whatsapp for go invest principal ending chat without follow up email always have scammy programs like buzz that loves rugpull,horribl cs whatsapp go invest princip end chat without follow email alway scammi program like buzz love rugpul,,negative,Touch n Go eWallet,en
"Baru download app ni..blm try lgi,tpi klu app ni btl2 mmbantu n mmudahkan,nnti bru tmbah 1 star lgi.",baru download app niblm try lgitpi klu app ni btl mmbantu n mmudahkannnti bru tmbah star lgi,download app niblm try lgitpi klu app btl mmbantu mmudahkannnti bru tmbah star lgi,,positive,Touch n Go eWallet,ms
i hope my past vaccine cert will appear in new my sejahtera.,i hope my past vaccine cert will appear in new my sejahtera,hope past vaccin cert appear new sejahtera,,positive,MySejahtera,en
mudah dn menjimatkan masa,mudah dn menjimatkan masa,mudah dn jimat,,neutral,Touch n Go eWallet,ms
Alhamdulillah mudahkan urusan,alhamdulillah mudahkan urusan,alhamdulillah mudah urus,,positive,Touch n Go eWallet,ms
"my account SUSPENDED , cannot open . my balance got in there",my account suspended cannot open my balance got in there,account suspend not open balanc got,,neutral,Touch n Go eWallet,en
since last two so difficult to use TnG. The system is to slow when try to do a payment. Sometimes can't enter at all!!!!!,since last two so difficult to use tng the system is to slow when try to do a payment sometimes cant enter at all,sinc last two difficult use tng system slow tri payment sometim cant enter,,negative,Touch n Go eWallet,en
"it is not even raining and yet, Grab says it is and charges me more than double.",it is not even raining and yet grab says it is and charges me more than double,not even rain yet grab say charg doubl,,neutral,Grab,en
saya tidak bisa masuk ewalet saya tolong di perbaiki,saya tidak bisa masuk ewalet saya tolong di perbaiki,tidak ewalet tolong baik,,neutral,Touch n Go eWallet,ms
So many terrible drivers,so many terrible drivers,mani terribl driver,,negative,Grab,en
"acc sy tak boleh log in kenape yer, sy terlupe no pin & password tapi dah ikot arahan diberi tapi still tak boleh, dia kata ""ada yg tak kena"" ape perlu sy buat untuk dapatkan semula acc sy",acc sy tak boleh log in kenape yer sy terlupe no pin password tapi dah ikot arahan diberi tapi still tak boleh dia kata ada yg tak kena ape perlu sy buat untuk dapatkan semula acc sy,acc sy tak log kenape yer sy terlupe no pin password dah ikot arah still tak yg tak ape sy dapat acc sy,,negative,Touch n Go eWallet,ms
"stupid your app, no guarantee for lower price, just greedy people",stupid your app no guarantee for lower price just greedy people,stupid app no guarante lower price greedi peopl,,negative,Grab,en
"Please provide the option of reverting to the previous option, because there's a function available in the old, but no longer available now.",please provide the option of reverting to the previous option because theres a function available in the old but no longer available now,pleas provid option revert previous option there function avail old no longer avail,,neutral,MySejahtera,en
"password aku dah tulis betul tiba² dia cakap salah, tak pasal² kena tukar password dengan tunggu 3 jam",password aku dah tulis betul tiba² dia cakap salah tak pasal² kena tukar password dengan tunggu jam,password dah tulis cakap salah tak tukar password tunggu jam,,negative,Touch n Go eWallet,ms
"terbaik ..setakat ini, naik taraf lagi pada masa-² hadapan.very good, E'wallet digital..",terbaik setakat ini naik taraf lagi pada masa² hadapanvery good ewallet digital,baik takat taraf hadapanvery good ewallet digital,,positive,Touch n Go eWallet,ms
the app is good but i dont know how to update covid test status,the app is good but i dont know how to update covid test status,app good dont know updat covid test status,,positive,MySejahtera,en
"Apps are great to use, but for grab rides, some pickup points in Singapore for example new estates like Tengah, is very confusing for drivers and/or passengers. It would be great if the company could train or update their maps drivers/riders use. this is so that they would know where to go to.",apps are great to use but for grab rides some pickup points in singapore for example new estates like tengah is very confusing for drivers andor passengers it would be great if the company could train or update their maps driversriders use this is so that they would know where to go to,app great use grab ride pickup point singapor exampl new estat like tengah confus driver andor passeng would great compani could train updat map driversrid use would know go,,neutral,Grab,en
nice apps. easy to use. easy to book a car and fast service.,nice apps easy to use easy to book a car and fast service,nice app easi use easi book car fast servic,,positive,Grab,en
WOW. AWESOME MYSEJAHTERA APP JUST GOT UPDATED WITH FUTURISTIC HIGH-TECH LOOKING!,wow awesome mysejahtera app just got updated with futuristic hightech looking,wow awesom mysejahtera app got updat futurist hightech look,,positive,MySejahtera,en
kenapa bahagian health card jadi kosong? padahal ada rekod derma darah sebelum ini.,kenapa bahagian health card jadi kosong padahal ada rekod derma darah sebelum ini,bahagian health card kosong rekod derma darah,,neutral,MySejahtera,en
"since last 2 month , loading of app to scan to pay getting lagging. whereas Maybank QR Pay instantly can scan.",since last month loading of app to scan to pay getting lagging whereas maybank qr pay instantly can scan,sinc last month load app scan pay get lag wherea maybank qr pay instant scan,,neutral,Touch n Go eWallet,en
"I hope Grab team can consider allowing small dogs like toy poodles in standard Grab cars, as long as they are properly contained (carrier or seat cover). GrabPet seems more suitable for large dogs, and the fare can be too high for small, well-behaved pets. This change would make trips more affordable and convenient for pet owners while still respecting drivers. Or maybe add GrabPet for 4-seater :)",i hope grab team can consider allowing small dogs like toy poodles in standard grab cars as long as they are properly contained carrier or seat cover grabpet seems more suitable for large dogs and the fare can be too high for small wellbehaved pets this change would make trips more affordable and convenient for pet owners while still respecting drivers or maybe add grabpet for seater,hope grab team consid allow small dog like toy poodl standard grab car long proper contain carrier seat cover grabpet seem suitabl larg dog fare high small wellbehav pet chang would make trip afford conveni pet owner still respect driver mayb add grabpet seater,,positive,Grab,en
"dah makin laju dh, dulu asyik lag jer... kalau boleh buat la redeem coin tu setiap hari tknak voucher, better coin boleh kumpul 😁",dah makin laju dh dulu asyik lag jer kalau boleh buat la redeem coin tu setiap hari tknak voucher better coin boleh kumpul,dah laju dh asyik lag jer la redeem coin tknak voucher better coin kumpul,😁,positive,Touch n Go eWallet,en
senang membuat pembayaran,senang membuat pembayaran,senang bayar,,positive,Touch n Go eWallet,ms
"Salam, harap boleh tmbah fungsi rekod derma darah. T.kasih",salam harap boleh tmbah fungsi rekod derma darah tkasih,harap tmbah fungsi rekod derma darah tkasih,,positive,MySejahtera,en
mudah dah sekarang guna mysejahtera....,mudah dah sekarang guna mysejahtera,mudah dah mysejahtera,,positive,MySejahtera,ms
susah babi mw book,susah babi mw book,susah babi mw book,,neutral,Grab,en
"Delivery Man do not carry any changes with them, But service is good.",delivery man do not carry any changes with them but service is good,deliveri man not carri chang servic good,,neutral,Grab,en
pin lokasi tidak tepat Jln Dtk Ajibah Abol,pin lokasi tidak tepat jln dtk ajibah abol,pin lokasi tidak jln dtk ajibah abol,,negative,Grab,ms
