text,clean_text,processed_text,emojis,label,app,language
"I can't log out of the application. When I want to log out, nothing comes out and I see that my husband's number is still there to log in even though we have separated the way to log in using our respective emails. Then there are several displays that don't show anything, it's blank and I want to log out and try to log in using my own ID, it doesn't give any response. I've uninstalled and reinstalled this application several times but when I want to open the account information section it keeps",i cant log out of the application when i want to log out nothing comes out and i see that my husbands number is still there to log in even though we have separated the way to log in using our respective emails then there are several displays that dont show anything its blank and i want to log out and try to log in using my own id it doesnt give any response ive uninstalled and reinstalled this application several times but when i want to open the account information section it keeps,cant log applic want log noth come see husband number still log even though separ way log use respect email sever display dont show anyth blank want log tri log use id doesnt give respons ive uninstal reinstal applic sever time want open account inform section keep,,neutral,MySejahtera,en
sometimes the facilities health not appear and all appointment are not available to book,sometimes the facilities health not appear and all appointment are not available to book,sometim facil health not appear appoint not avail book,,negative,MySejahtera,en
"With this new updated app, I can't find my covid 19 vaccination record. Is it available in this updated apps.",with this new updated app i cant find my covid vaccination record is it available in this updated apps,new updat app cant find covid vaccin record avail updat app,,neutral,MySejahtera,en
masuk kan aplikasi yang tidak mau kena langgan lepas tu kena pay direct tiba tiba,masuk kan aplikasi yang tidak mau kena langgan lepas tu kena pay direct tiba tiba,aplikasi tidak langgan lepas pay direct,,negative,Touch n Go eWallet,ms
Apa yang ko dh buat? Mana history Data medication aku🤦🏻‍♂️ orng nk buat rujukan ko pegi buang pula,apa yang ko dh buat mana history data medication aku orng nk buat rujukan ko pegi buang pula,ko dh histori data medic orng nk rujukan ko pegi buang,🤦🏻‍♂️,neutral,MySejahtera,en
Soo good ❤️😘😍😘😊👍,soo good,soo good,😍😊😘👍❤️,positive,MySejahtera,en
tak boleh nk book oppiment,tak boleh nk book oppiment,tak nk book oppiment,,negative,MySejahtera,ms
"nice app, helpful and simple",nice app helpful and simple,nice app help simpl,,positive,Grab,en
यहां अप डिलीवरी के लिए बहुत बढ़िया ऐप है मैंने इसे उसे किया और मुझे बहुत अच्छालगा 😇*,यहां अप डिलीवरी के लिए बहुत बढ़िया ऐप है मैंने इसे उसे किया और मुझे बहुत अच्छालगा,अप ऐप और,😇,positive,Grab,en
Easy to remember it.,easy to remember it,easi rememb,,neutral,MySejahtera,en
Fast rides and deliveries with clear pricing. Smooth and reliable,fast rides and deliveries with clear pricing smooth and reliable,fast ride deliveri clear price smooth reliabl,,positive,Grab,en
"penggunaan grab memang terbaik dan berbaloi, senang dan Ok.",penggunaan grab memang terbaik dan berbaloi senang dan ok,guna grab baik berbaloi senang ok,,positive,Grab,ms
Becareful always follow the official guidelines to verify is it got malware or malicious apps .,becareful always follow the official guidelines to verify is it got malware or malicious apps,becar alway follow offici guidelin verifi got malwar malici app,,neutral,Touch n Go eWallet,en
it x log in or work efficiently.,it x log in or work efficiently,log work effici,,negative,Touch n Go eWallet,en
"After the previous update, the app took forever to load",after the previous update the app took forever to load,previous updat app took forev load,,negative,Touch n Go eWallet,en
"after so long not open this app since pkp (covid) , now I open it 😁😄",after so long not open this app since pkp covid now i open it,long not open app sinc pkp covid open,😄😁,neutral,MySejahtera,en
My Grab for the airport was good on the streets one charged me 100 for a 33 priced ride and when I was coming home the grab driver tried to charge me 150.00 for the same 33.00 ride 👎🏾,my grab for the airport was good on the streets one charged me for a priced ride and when i was coming home the grab driver tried to charge me for the same ride,grab airport good street one charg price ride come home grab driver tri charg ride,👎🏾,negative,Grab,en
"Apps buffering took a shorter time before BUDI95, please look into this as it really affects payment speed.",apps buffering took a shorter time before budi please look into this as it really affects payment speed,app buffer took shorter time budi pleas look realli affect payment speed,,negative,Touch n Go eWallet,en
wow it's very nice 👍,wow its very nice,wow nice,👍,positive,Grab,en
"Grab sekarang banyak mahallllllll gile,,dia masih jauh pun dia ambik,,nnti kalau dah tak ada penumpang cam texi baru tau",grab sekarang banyak mahal giledia masih jauh pun dia ambiknnti kalau dah tak ada penumpang cam texi baru tau,grab mahal giledia ambiknnti dah tak tumpang cam texi tau,,neutral,Grab,ms
over all the service was fine until it came into a refund issue it has been one weeks almost two weeks and still amount money inside my account still remain the same,over all the service was fine until it came into a refund issue it has been one weeks almost two weeks and still amount money inside my account still remain the same,servic fine came refund issu one week almost two week still amount money insid account still remain,,negative,Touch n Go eWallet,en
kenapa makin lama makin slow server dia,kenapa makin lama makin slow server dia,slow server,,negative,Touch n Go eWallet,en
kat bahagian mana yg sijil vaksin ni..cari tak jumpa,kat bahagian mana yg sijil vaksin nicari tak jumpa,kat bahagian yg sijil vaksin nicari tak jumpa,,negative,MySejahtera,ms
So easy for me,so easy for me,easi,,positive,Touch n Go eWallet,en
"I love the new look, but only downside im no longer able to print 3 vaccine cert on same page like before.. I'm looking forward to bringing that back.. please be able to verify the dependent because several son take care of their parents",i love the new look but only downside im no longer able to print vaccine cert on same page like before im looking forward to bringing that back please be able to verify the dependent because several son take care of their parents,love new look downsid im no longer abl print vaccin cert page like im look forward bring back pleas abl verifi depend sever son take care parent,,positive,MySejahtera,en
"The app keeps telling I'm offline when I'm using mobile data, but it works fine when I'm using wifi…… please fix this……",the app keeps telling im offline when im using mobile data but it works fine when im using wifi…… please fix this……,app keep tell im offlin im use mobil data work fine im use pleas fix,,negative,MySejahtera,en
"Macam mana nak guna helpdesk ni ? Saya mahukan sijil vaksinasi secepat mungkin tapi sistem ini sangat susah , tolong segera saya sangat memerluka ,terima kasih",macam mana nak guna helpdesk ni saya mahukan sijil vaksinasi secepat mungkin tapi sistem ini sangat susah tolong segera saya sangat memerluka terima kasih,nak helpdesk mahukan sijil vaksinasi cepat sistem susah tolong luka terima kasih,,neutral,MySejahtera,ms
"kenapa saya nak login ACC saya tidak dapat, dia nyatakan permintaan anda tidak berjaya.",kenapa saya nak login acc saya tidak dapat dia nyatakan permintaan anda tidak berjaya,nak login acc tidak nyata minta tidak jaya,,negative,Touch n Go eWallet,ms
grab terbaik dalam keadaan saya takde duit saya boleh naik grab dangan bayaran grabpay latter.. terimakasih grab mudahkan keadaan saya,grab terbaik dalam keadaan saya takde duit saya boleh naik grab dangan bayaran grabpay latter terimakasih grab mudahkan keadaan saya,grab baik takde duit grab dang bayar grabpay latter terimakasih grab mudah,,positive,Grab,ms
The driver is very nice and polite. Highly recommended.,the driver is very nice and polite highly recommended,driver nice polit high recommend,,positive,Grab,en
latest update theres no card optional to topup.. very difficult to topup card.. give us back button card infront UI,latest update theres no card optional to topup very difficult to topup card give us back button card infront ui,latest updat there no card option topup difficult topup card give us back button card infront ui,,negative,Touch n Go eWallet,en
"ia akan lebih baik bila mana semua qr duitnow boleh di scan utk buat pembayaran.. kadang ada yg boleh, kadang tak boleh..",ia akan lebih baik bila mana semua qr duitnow boleh di scan utk buat pembayaran kadang ada yg boleh kadang tak boleh,qr duitnow scan utk pembayaran kadang yg kadang tak,,neutral,Touch n Go eWallet,en
정확한 지도표시가 잘안되어 안타깝습니다,정확한 지도표시가 잘안되어 안타깝습니다,정확한 지도표시가 잘안되어 안타깝습니다,,positive,Grab,en
Saya tidak dapat update status risiko convid sebab itu saya tidak dibenarkan masuk kerja. Apa perlu saya buat?,saya tidak dapat update status risiko convid sebab itu saya tidak dibenarkan masuk kerja apa perlu saya buat,tidak update status risiko convid tidak benar,,neutral,MySejahtera,ms
"kurang bgt, malah ngasih driver yang masih ada orderan, redup aja redup",kurang bgt malah ngasih driver yang masih ada orderan redup aja redup,bgt ngasih driver orderan redup aja redup,,neutral,Grab,en
Keep fighting dignity,keep fighting dignity,keep fighting dignity,,neutral,MySejahtera,ms
it's rather unfriendly,its rather unfriendly,rather unfriend,,neutral,Touch n Go eWallet,en
tolonglah time xda cash .harap duit dlm tng saja. masa 2 pulak akaun secure ntah ap lh......x bleh guna sma sekali......rasa mcm nak memaki smpi nenek moyang tng.....geram nya ak.....,tolonglah time xda cash harap duit dlm tng saja masa pulak akaun secure ntah ap lhx bleh guna sma sekalirasa mcm nak memaki smpi nenek moyang tnggeram nya ak,tolong time xda cash harap duit dlm tng pulak akaun secure ntah ap lhx bleh sma sekalirasa mcm nak maki smpi nenek moyang tnggeram ak,,negative,Touch n Go eWallet,ms
tgah bukak app.. tetiba app log out.. dah kenapa.. app my sejahtera ni.. sblom ni okay je. Minta perbaiki pengurusan app my sejahtera ni.. jgn menyusahkan rakyat bila khidmat ni diperlukan.. chooii !! 😤🤬😡,tgah bukak app tetiba app log out dah kenapa app my sejahtera ni sblom ni okay je minta perbaiki pengurusan app my sejahtera ni jgn menyusahkan rakyat bila khidmat ni diperlukan chooii,tgah bukak app tetiba app log dah app sejahtera sblom okay baik urus app sejahtera jgn susah rakyat khidmat chooii,🤬😤😡,negative,MySejahtera,ms
Go+ untuk warganegara saja Sye nk tapi tak boleh,go untuk warganegara saja sye nk tapi tak boleh,go warganegara sye nk tak,,neutral,Touch n Go eWallet,ms
useless when emergency,useless when emergency,useless emerg,,negative,Grab,en
sangat tepati masa,sangat tepati masa,tepat,,positive,Grab,ms
x boleh bayar bil elektrik dan banyak pulak iklan,x boleh bayar bil elektrik dan banyak pulak iklan,bayar bil elektrik pulak iklan,,negative,Touch n Go eWallet,ms
knp ya tng sekarang semakin slow,knp ya tng sekarang semakin slow,knp tng slow,,neutral,Touch n Go eWallet,ms
Akaun tng saya kene rm5k abis ilang,akaun tng saya kene rm k abis ilang,akaun tng kene rm abis ilang,,negative,Touch n Go eWallet,ms
"Tak cerdik punya developer applikasi ni...nak topup kad tng pun payah nak cari feature tu. Jual kad RFID, tadi nak topup dgn apps pun sukar.",tak cerdik punya developer applikasi ninak topup kad tng pun payah nak cari feature tu jual kad rfid tadi nak topup dgn apps pun sukar,tak cerdik develop applikasi ninak topup kad tng payah nak cari featur jual kad rfid nak topup dgn app sukar,,negative,Touch n Go eWallet,en
rekod vaksin saya tidak dapat di buka.. terlupa kata laluan,rekod vaksin saya tidak dapat di buka terlupa kata laluan,rekod vaksin tidak buka lupa lalu,,negative,MySejahtera,ms
This app helping not much,this app helping not much,app help not much,,neutral,Grab,en
always crash on my device poco c65... happened for a few days already... before this just normal,always crash on my device poco c happened for a few days already before this just normal,alway crash devic poco happen day alreadi normal,,neutral,Touch n Go eWallet,en
sudah tiada grab coin kah percuma bayar grab coin bodoh percuma aku active grab coin tapi bila diguna langsung tidak ada grab coin,sudah tiada grab coin kah percuma bayar grab coin bodoh percuma aku active grab coin tapi bila diguna langsung tidak ada grab coin,tiada grab coin kah bayar grab coin bodoh active grab coin guna tidak grab coin,,negative,Grab,ms
"mudah, cepat n memuaskan",mudah cepat n memuaskan,mudah cepat muas,,positive,Grab,ms
simple n easy,simple n easy,simpl easi,,positive,Touch n Go eWallet,en
pening lagy untuk menggunakan kemudahan touch NGO terbaru,pening lagy untuk menggunakan kemudahan touch ngo terbaru,pening lagy mudah touch ngo baru,,neutral,Touch n Go eWallet,ms
blood type and number of blood donation records missing,blood type and number of blood donation records missing,blood type number blood donat record miss,,neutral,MySejahtera,en
Search for biller e.g. Celcom very slow,search for biller eg celcom very slow,search biller eg celcom slow,,neutral,Touch n Go eWallet,en
Semua driver jauh,semua driver jauh,driver,,negative,Grab,ms
"love almost everything in it except the point and the reward, they should make that the point didn't get expired because the reward here is not good and the point need for that is quite high",love almost everything in it except the point and the reward they should make that the point didnt get expired because the reward here is not good and the point need for that is quite high,love almost everyth except point reward make point didnt get expir reward not good point need quit high,,positive,Touch n Go eWallet,en
"pretty good overall, but had 3 drivers in a row cancel this morning. also, the actual time until the drive shows up is regularly 2x as long as the estimate shown initially.",pretty good overall but had drivers in a row cancel this morning also the actual time until the drive shows up is regularly x as long as the estimate shown initially,pretti good overal driver row cancel morn also actual time drive show regular long estim shown initi,,positive,Grab,en
Terima kasih servis yang baik,terima kasih servis yang baik,terima kasih servis,,positive,Grab,ms
Saya tidak boleh menggunakan aplikasi ini,saya tidak boleh menggunakan aplikasi ini,tidak aplikasi,,neutral,Touch n Go eWallet,ms
Implementation of budi and mykasih is good,implementation of budi and mykasih is good,implement budi mykasih good,,positive,Touch n Go eWallet,en
"Very Useful for delivery of food. Very affordable. Can you please, put how many kilometers from the place where we will order to our place next time? Cause it's hard to determine where the nearest to our place.",very useful for delivery of food very affordable can you please put how many kilometers from the place where we will order to our place next time cause its hard to determine where the nearest to our place,use deliveri food afford pleas put mani kilomet place order place next time caus hard determin nearest place,,positive,Grab,en
menstabilkan kesihatan terbaik.,menstabilkan kesihatan terbaik,stabil kesihatan baik,,positive,MySejahtera,ms
kemaskini de email bahru.,kemaskini de email bahru,kemaskini de email bahru,,neutral,Touch n Go eWallet,ms
app terbaik👍memudahkan rakyat malaysia,app terbaikmemudahkan rakyat malaysia,app terbaikmemudahkan rakyat malaysia,👍,positive,Touch n Go eWallet,ms
kenapa tak boleh tukar nama akaun tng wallet?,kenapa tak boleh tukar nama akaun tng wallet,tak tukar nama akaun tng wallet,,neutral,Touch n Go eWallet,ms
"Driver and food were fine, but Grab's system is a joke. Why route my order to Parada when there are closer Chooks-to-Go branches in Paso and Poblacion? Your broken algorithm forced an absurd 45-minute wait time for pre-cooked liempo that just needs chopping. Worst of all, you charged a ridiculous ₱81 delivery fee on a ₱290 order—a 30% markup! Premium fees for garbage logistics. Fix your app!",driver and food were fine but grabs system is a joke why route my order to parada when there are closer chookstogo branches in paso and poblacion your broken algorithm forced an absurd minute wait time for precooked liempo that just needs chopping worst of all you charged a ridiculous ₱ delivery fee on a ₱ order—a markup premium fees for garbage logistics fix your app,driver food fine grab system joke rout order parada closer chookstogo branch paso poblacion broken algorithm forc absurd minut wait time precook liempo need chop worst charg ridicul deliveri fee order markup premium fee garbag logist fix app,,negative,Grab,en
Perkhidmatan yg cepat,perkhidmatan yg cepat,khidmat yg cepat,,positive,Grab,ms
"i like this app, easy and useful",i like this app easy and useful,like app easi use,,positive,Touch n Go eWallet,en
"sebelum dh daftar. tp hp rosak. so , nak download di handphone baru , tak dapat pula. Tapi berjaya je daftar.",sebelum dh daftar tp hp rosak so nak download di handphone baru tak dapat pula tapi berjaya je daftar,dh daftar tp hp rosak nak download handphon tak berjaya daftar,,neutral,MySejahtera,en
penghantaran yang lambat 👎,penghantaran yang lambat,hantar lambat,👎,negative,Grab,ms
apps yg terbaik..,apps yg terbaik,apps yg baik,,positive,MySejahtera,ms
darkmode on chat still not fixed yet,darkmode on chat still not fixed yet,darkmod chat still not fix yet,,neutral,Grab,en
"i up 2 star because annoying promotion notification is not there anymore, thanks TnGo developer. It remains 3 star because new interface not really user friendly and loading favorite=>more took ages to load 😅...",i up star because annoying promotion notification is not there anymore thanks tngo developer it remains star because new interface not really user friendly and loading favoritemore took ages to load,star annoy promot notif not anymor thank tngo develop remain star new interfac not realli user friend load favoritemor took age load,😅,neutral,Touch n Go eWallet,en
Night shop still available for late order. Tq grab,night shop still available for late order tq grab,night shop still avail late order tq grab,,positive,Grab,en
"Grab is a very useful app for transportation and food delivery. The service is convenient, dependable, and makes daily activities much easier.",grab is a very useful app for transportation and food delivery the service is convenient dependable and makes daily activities much easier,grab use app transport food deliveri servic conveni depend make daili activ much easier,,positive,Grab,en
"terbaik lahh, memudahkan",terbaik lahh memudahkan,baik lahh mudah,,positive,Touch n Go eWallet,ms
Mallory awards 10 contributions.,mallory awards contributions,mallori award contribut,,positive,MySejahtera,en
Kita telah di perbodohkn oleh mereka..punca 22 bulan memerintah kerajaan gagal kawal Covid..bahkn ditipu vaksin utk mmbunuh manusia..vaksin xkn d cipta masa terdekat..Mereka Berkomplot mmbunuh rakyat,kita telah di perbodohkn oleh merekapunca bulan memerintah kerajaan gagal kawal covidbahkn ditipu vaksin utk mmbunuh manusiavaksin xkn d cipta masa terdekatmereka berkomplot mmbunuh rakyat,perbodohkn merekapunca memerintah kerajaan gagal kawal covidbahkn ditipu vaksin utk mmbunuh manusiavaksin xkn cipta terdekatmereka berkomplot mmbunuh rakyat,,neutral,MySejahtera,en
Boleh tak tambahkan maklumat suntikan typhoid dlm nie...susah la klo kena bwk kad jewrr...klo ade dlm mysejahtera lgy senang...,boleh tak tambahkan maklumat suntikan typhoid dlm niesusah la klo kena bwk kad jewrrklo ade dlm mysejahtera lgy senang,tak tambah maklumat sunti typhoid dlm niesusah la klo bwk kad jewrrklo ade dlm mysejahtera lgy senang,,neutral,MySejahtera,ms
"too many noti, separate it",too many noti separate it,many not separate,,neutral,Touch n Go eWallet,ms
"Saya booked dental appointment dalam apps mysejahtera tapi kenapa sejak minggu lepas asyik loading je page appointment tu? Appt saya tadi, takdapat saya nak tunjuk Dr saya dah booked appt. Untung saya dah screenshot siap siap",saya booked dental appointment dalam apps mysejahtera tapi kenapa sejak minggu lepas asyik loading je page appointment tu appt saya tadi takdapat saya nak tunjuk dr saya dah booked appt untung saya dah screenshot siap siap,book dental appoint app mysejahtera minggu lepa asyik load page appoint appt takdapat nak dr dah book appt untung dah screenshot,,neutral,MySejahtera,en
"Làm UX khó xài, nhiều menu ẩn. Muốn edit lại review chả biến lần vào đâu. Nói chung app ngu vkl",làm ux khó xài nhiều menu ẩn muốn edit lại review chả biến lần vào đâu nói chung app ngu vkl,làm ux khó xài nhiều menu ẩn muốn edit lại review chả biến lần vào đâu nói chung app ngu vkl,,neutral,Grab,en
kenapa tng jdi lmbt slow msuk adoi susah nk transfer tollng la baiki,kenapa tng jdi lmbt slow msuk adoi susah nk transfer tollng la baiki,tng jdi lmbt slow msuk adoi susah nk transfer tollng la baik,,negative,Touch n Go eWallet,ms
"ok mudah untuk membayar, duit pun cepat jer habis,",ok mudah untuk membayar duit pun cepat jer habis,ok mudah bayar duit cepat jer habis,,neutral,Touch n Go eWallet,ms
Screenshoot picture dan pindah ke duitnown juga tidak pernah digunakan ja lagi.,screenshoot picture dan pindah ke duitnown juga tidak pernah digunakan ja lagi,screenshoot picture pindah duitnown tidak ja,,neutral,Grab,ms
just got to use the application,just got to use the application,got use applic,,positive,Grab,en
auto reload no longer working...,auto reload no longer working,auto reload no longer work,,neutral,Touch n Go eWallet,en
pemanduan yg cemerlang,pemanduan yg cemerlang,pandu yg cemerlang,,positive,Grab,ms
Works perfectly for the Redmi A5. Thank you for fixing my problem!!,works perfectly for the redmi a thank you for fixing my problem,work perfect redmi thank fix problem,,positive,Touch n Go eWallet,en
terlalu bnyak kmudahan yg dsediakan di TNG ini..,terlalu bnyak kmudahan yg dsediakan di tng ini,bnyak kmudahan yg dsediakan tng,,neutral,Touch n Go eWallet,en
tak boleh tekan nama untuk buat temu janji 😑,tak boleh tekan nama untuk buat temu janji,tak tekan nama temu janji,😑,negative,MySejahtera,ms
good for e wallet,good for e wallet,good wallet,,positive,Touch n Go eWallet,en
X bagus 😓,x bagus,bagus,😓,negative,MySejahtera,ms
I reported to Grab a restaurant misleading customers by displaying a full-size pizza photo but delivering only 2 slices. Grab has allowed the restaurant to continue using the full-size pizza photo despite it being misleading.,i reported to grab a restaurant misleading customers by displaying a fullsize pizza photo but delivering only slices grab has allowed the restaurant to continue using the fullsize pizza photo despite it being misleading,report grab restaur mislead custom display fullsiz pizza photo deliv slice grab allow restaur continu use fullsiz pizza photo despit mislead,,negative,Grab,en
Location stalls quite often. But overall very good,location stalls quite often but overall very good,locat stall quit often overal good,,positive,Grab,en
kenapa buat pindahan duit ke bank 10 ringgit dipotong. pindah 30 masuk bank 20 jerr,kenapa buat pindahan duit ke bank ringgit dipotong pindah masuk bank jerr,pindah duit bank ringgit potong pindah bank jerr,,negative,Touch n Go eWallet,ms
apu... slow amat,apu slow amat,apu slow,,neutral,Touch n Go eWallet,ms
Why my username and password is correct but cannot login in due to invalid username and password?,why my username and password is correct but cannot login in due to invalid username and password,usernam password correct not login due invalid usernam password,,neutral,MySejahtera,en
Is the grab system down now ?,is the grab system down now,grab system,,neutral,Grab,en
"After my last complain about there is no available slot for dental check up for almost every month , the new update finally improve the app a little. However, when I try booking for appointment in the next 6 month - let's say for February 2026, there is no available slot even after I check for every date in February and even March. Hopefully this can be fixed too 😭",after my last complain about there is no available slot for dental check up for almost every month the new update finally improve the app a little however when i try booking for appointment in the next month lets say for february there is no available slot even after i check for every date in february and even march hopefully this can be fixed too,last complain no avail slot dental check almost everi month new updat final improv app littl howev tri book appoint next month let say februari no avail slot even check everi date februari even march hope fix,😭,neutral,MySejahtera,en
nice platform for taxi and food🙏🙏🤗,nice platform for taxi and food,nice platform taxi food,🙏🤗,positive,Grab,en
